{
  "meta": {
    "project": "sonogyn-pro",
    "description": "Номограммы фетометрии плода (11–14 нед и II–III триместры, эхокардиография), оцифрованные из справочного PDF",
    "sources_authors": [
      "Н.А. Алтынник",
      "М.В. Медведев",
      "О.И. Козлова",
      "У.А. Струпнева",
      "Мари",
      "Moore",
      "Shapiro",
      "Pasquini",
      "Chaoui",
      "Li",
      "Benacerraf"
    ],
    "version": "1.0.0",
    "units_note": "все длины в мм, скорости в см/с, площади в мм²"
  },
  "nomograms": [
    {
      "id": "crl_11_14",
      "key": "CRL",
      "title": "Копчико-теменной размер (КТР) эмбриона/плода",
      "source": "Алтынник, Медведев, 2001",
      "category": "first_trimester",
      "unit": "mm",
      "x_axis": {
        "type": "ga_days",
        "label": "Срок беременности (нед+дни)"
      },
      "percentiles": [
        5,
        50,
        95
      ],
      "rows": [
        {
          "ga": "7+0",
          "p5": 5,
          "p50": 8,
          "p95": 11
        },
        {
          "ga": "7+1",
          "p5": 6,
          "p50": 9,
          "p95": 12
        },
        {
          "ga": "7+2",
          "p5": 7,
          "p50": 10,
          "p95": 13
        },
        {
          "ga": "7+3",
          "p5": 8,
          "p50": 11,
          "p95": 14
        },
        {
          "ga": "7+4",
          "p5": 9,
          "p50": 12,
          "p95": 15
        },
        {
          "ga": "7+5",
          "p5": 9,
          "p50": 13,
          "p95": 16
        },
        {
          "ga": "7+6",
          "p5": 10,
          "p50": 13,
          "p95": 17
        },
        {
          "ga": "8+0",
          "p5": 10,
          "p50": 14,
          "p95": 18
        },
        {
          "ga": "8+1",
          "p5": 11,
          "p50": 15,
          "p95": 19
        },
        {
          "ga": "8+2",
          "p5": 11,
          "p50": 16,
          "p95": 21
        },
        {
          "ga": "8+3",
          "p5": 12,
          "p50": 17,
          "p95": 22
        },
        {
          "ga": "8+4",
          "p5": 13,
          "p50": 18,
          "p95": 23
        },
        {
          "ga": "8+5",
          "p5": 14,
          "p50": 19,
          "p95": 24
        },
        {
          "ga": "8+6",
          "p5": 15,
          "p50": 20,
          "p95": 25
        },
        {
          "ga": "9+0",
          "p5": 16,
          "p50": 22,
          "p95": 27
        },
        {
          "ga": "9+1",
          "p5": 17,
          "p50": 23,
          "p95": 29
        },
        {
          "ga": "9+2",
          "p5": 18,
          "p50": 24,
          "p95": 30
        },
        {
          "ga": "9+3",
          "p5": 19,
          "p50": 25,
          "p95": 31
        },
        {
          "ga": "9+4",
          "p5": 20,
          "p50": 26,
          "p95": 32
        },
        {
          "ga": "9+5",
          "p5": 21,
          "p50": 27,
          "p95": 34
        },
        {
          "ga": "9+6",
          "p5": 22,
          "p50": 29,
          "p95": 36
        },
        {
          "ga": "10+0",
          "p5": 24,
          "p50": 31,
          "p95": 38
        },
        {
          "ga": "10+1",
          "p5": 25,
          "p50": 33,
          "p95": 41
        },
        {
          "ga": "10+2",
          "p5": 26,
          "p50": 34,
          "p95": 42
        },
        {
          "ga": "10+3",
          "p5": 27,
          "p50": 35,
          "p95": 43
        },
        {
          "ga": "10+4",
          "p5": 29,
          "p50": 37,
          "p95": 45
        },
        {
          "ga": "10+5",
          "p5": 31,
          "p50": 39,
          "p95": 47
        },
        {
          "ga": "10+6",
          "p5": 33,
          "p50": 41,
          "p95": 49
        },
        {
          "ga": "11+0",
          "p5": 34,
          "p50": 42,
          "p95": 50
        },
        {
          "ga": "11+1",
          "p5": 35,
          "p50": 43,
          "p95": 51
        },
        {
          "ga": "11+2",
          "p5": 36,
          "p50": 44,
          "p95": 52
        },
        {
          "ga": "11+3",
          "p5": 37,
          "p50": 45,
          "p95": 54
        },
        {
          "ga": "11+4",
          "p5": 38,
          "p50": 47,
          "p95": 56
        },
        {
          "ga": "11+5",
          "p5": 39,
          "p50": 48,
          "p95": 57
        },
        {
          "ga": "11+6",
          "p5": 40,
          "p50": 49,
          "p95": 58
        },
        {
          "ga": "12+0",
          "p5": 42,
          "p50": 51,
          "p95": 59
        },
        {
          "ga": "12+1",
          "p5": 44,
          "p50": 53,
          "p95": 62
        },
        {
          "ga": "12+2",
          "p5": 45,
          "p50": 55,
          "p95": 65
        },
        {
          "ga": "12+3",
          "p5": 47,
          "p50": 57,
          "p95": 67
        },
        {
          "ga": "12+4",
          "p5": 49,
          "p50": 59,
          "p95": 69
        },
        {
          "ga": "12+5",
          "p5": 50,
          "p50": 61,
          "p95": 72
        },
        {
          "ga": "12+6",
          "p5": 51,
          "p50": 62,
          "p95": 73
        },
        {
          "ga": "13+0",
          "p5": 51,
          "p50": 63,
          "p95": 75
        },
        {
          "ga": "13+1",
          "p5": 53,
          "p50": 65,
          "p95": 77
        },
        {
          "ga": "13+2",
          "p5": 54,
          "p50": 66,
          "p95": 78
        },
        {
          "ga": "13+3",
          "p5": 56,
          "p50": 68,
          "p95": 80
        },
        {
          "ga": "13+4",
          "p5": 58,
          "p50": 70,
          "p95": 82
        },
        {
          "ga": "13+5",
          "p5": 59,
          "p50": 72,
          "p95": 85
        },
        {
          "ga": "13+6",
          "p5": 61,
          "p50": 74,
          "p95": 87
        },
        {
          "ga": "14+0",
          "p5": 63,
          "p50": 76,
          "p95": 89
        },
        {
          "ga": "14+1",
          "p5": 64,
          "p50": 78,
          "p95": 92
        }
      ]
    },
    {
      "id": "bpr_11_14",
      "key": "BPD",
      "title": "Бипариетальный размер (БПР)",
      "source": "Алтынник, Медведев, 2002",
      "category": "first_trimester",
      "unit": "mm",
      "x_axis": {
        "type": "ga_weeks",
        "label": "Срок беременности (нед)"
      },
      "percentiles": [
        5,
        50,
        95
      ],
      "rows": [
        {
          "ga_weeks": 11,
          "p5": 13,
          "p50": 17,
          "p95": 21
        },
        {
          "ga_weeks": 12,
          "p5": 18,
          "p50": 21,
          "p95": 24
        },
        {
          "ga_weeks": 13,
          "p5": 20,
          "p50": 24,
          "p95": 28
        },
        {
          "ga_weeks": 14,
          "p5": 23,
          "p50": 27,
          "p95": 31
        }
      ]
    },
    {
      "id": "hc_11_14",
      "key": "HC",
      "title": "Окружность головы (ОГ)",
      "source": "Алтынник, Медведев, 2002",
      "category": "first_trimester",
      "unit": "mm",
      "x_axis": {
        "type": "ga_weeks",
        "label": "Срок беременности (нед)"
      },
      "percentiles": [
        5,
        50,
        95
      ],
      "rows": [
        {
          "ga_weeks": 11,
          "p5": 53,
          "p50": 63,
          "p95": 73
        },
        {
          "ga_weeks": 12,
          "p5": 58,
          "p50": 71,
          "p95": 84
        },
        {
          "ga_weeks": 13,
          "p5": 72,
          "p50": 84,
          "p95": 96
        },
        {
          "ga_weeks": 14,
          "p5": 84,
          "p50": 97,
          "p95": 110
        }
      ]
    },
    {
      "id": "ac_11_14",
      "key": "AC",
      "title": "Окружность живота (ОЖ)",
      "source": "Алтынник, Медведев, 2002",
      "category": "first_trimester",
      "unit": "mm",
      "x_axis": {
        "type": "ga_weeks",
        "label": "Срок беременности (нед)"
      },
      "percentiles": [
        5,
        50,
        95
      ],
      "rows": [
        {
          "ga_weeks": 11,
          "p5": 40,
          "p50": 51,
          "p95": 62
        },
        {
          "ga_weeks": 12,
          "p5": 50,
          "p50": 61,
          "p95": 72
        },
        {
          "ga_weeks": 13,
          "p5": 58,
          "p50": 69,
          "p95": 80
        },
        {
          "ga_weeks": 14,
          "p5": 66,
          "p50": 78,
          "p95": 90
        }
      ]
    },
    {
      "id": "fl_11_14",
      "key": "FL",
      "title": "Длина бедренной кости (ДБК)",
      "source": "Алтынник, Медведев, 2002",
      "category": "first_trimester",
      "unit": "mm",
      "x_axis": {
        "type": "ga_weeks",
        "label": "Срок беременности (нед)"
      },
      "percentiles": [
        5,
        50,
        95
      ],
      "rows": [
        {
          "ga_weeks": 11,
          "p5": 3.4,
          "p50": 5.6,
          "p95": 7.8
        },
        {
          "ga_weeks": 12,
          "p5": 4.0,
          "p50": 7.3,
          "p95": 10.6
        },
        {
          "ga_weeks": 13,
          "p5": 7.0,
          "p50": 9.4,
          "p95": 11.8
        },
        {
          "ga_weeks": 14,
          "p5": 9.0,
          "p50": 12.4,
          "p95": 15.8
        }
      ]
    },
    {
      "id": "nt_by_crl",
      "key": "NT",
      "title": "Толщина воротникового пространства (ТВП)",
      "source": "Алтынник, Медведев, 2012",
      "category": "first_trimester",
      "unit": "mm",
      "x_axis": {
        "type": "crl_range_mm",
        "label": "КТР, мм"
      },
      "percentiles": [
        5,
        50,
        95
      ],
      "rows": [
        {